Journey ;ID;Code V0;Code VF;Experience;Theme;Service;Epic;Description;User;Priority;WP;Cartography 
Cross Journeys Onboarding;1;INFORMATIONV1.1;INFORMATIONV1.1-2;INFORMATION;Learning and teaching;Academic & Ulysseus Information;View the consolidated list of Ulysseus programs ;Access to one catalog that contains all the Ulysseus programs with 360 view for each program with key information: teachers, curriculum and classes, tuition, following job and studying opportunities ;Student;V1.1;T.7.2;Information and Documentation
Cross Journeys Onboarding;2;INFORMATIONV1.1;INFORMATIONV1.1-2;INFORMATION;Learning and teaching;Academic & Ulysseus Information;Feed the catalog of Ulysseus academic programs;The catalog should be automatically fed from each university's system;Admin staff;V1.1;T.3.1;Information and Documentation
Cross Journeys Onboarding;3;INFORMATIONV1.1;INFORMATIONV1.1-2;INFORMATION;Learning and teaching;Academic & Ulysseus Information;Search through the Ulysseus Programs ;Search through the programs based on a list of criteria (e.g. duration, faculty, study cycle);Student;V1.1;T.3.1;Information Search 
Cross Journeys Onboarding;4;INFORMATIONV1.1;INFORMATIONV1.1-2;INFORMATION;Learning and teaching;Academic & Ulysseus Information;Receive program recommendations ;"""Recommendation engine to enable the students to filter among all the programs and identify the ones that are the most relevant to him or her. 
It will be based on a number of criteria: my field of study or my interests, my studying background, my career choices """;Student;V1.1;T.3.1;Program Recommendations 
Cross Journeys Onboarding;5;INFORMATIONV1.1;INFORMATIONV1.1-1;INFORMATION;Learning and teaching;Academic & Ulysseus Information;Promote the Ulysseus programs toward students;"""Share presentation videos, testimonials in video or text format of alumni 
Mention of Gender Equality and EDI in Ulysseus in the public interface""";Admin staff;V1.1;T.7.2;Content Management 
Journey 2 Research Project Lifecycle;6;RESEARCH INFORMATIONV1.1;RESEARCH INFORMATIONV1.1-1;RESEARCH INFORMATION;Learning and teaching;Academic & Ulysseus Information;Promote Ulysseus research programs and key results ;Present Ulysseus Innovation Hubs, research grants and awards, creation of deep teach start-ups/spin-offs and key publications (scientific, reports, etc.);Researchers;V1.1;T.7.2;Information and Documentation
Cross Journeys Onboarding;7;INFORMATIONV1.1;INFORMATIONV1.1-2;INFORMATION;Learning and teaching;Academic & Ulysseus Information;Receive email notifications for any news related to the program ;This epics includes notifications related to the launch of new programs or informative events, updates on application deadlines. Students should be able to request to be notified by email. ;Student;V1.1;T.7.2;Notification Management 
Cross Journeys Innovation;8;ENTREPRENEURSHIPV1.1;ENTREPRENEURSHIPV1.1-11;ENTREPRENEURSHIP;Learning and teaching;Academic & Ulysseus Information;Review the existing incubation programs and the pre-requisites;Search through the available programs, read the program description ;Entrepreneur;V1.1;T.2.6;Information Search 
Cross Journeys Onboarding;9;APPLICATIONV1.1;APPLICATIONV1.1-1;APPLICATION;Application;Academic & Ulysseus Information;Review financial aid programs ;"""Review the list of financial aid and support programs and follow the instruction to apply 
""";Student;V1.1;T.6.8;Information & Documentation
Cross Journeys Onboarding;10;INFORMATIONV1.1;INFORMATIONV1.1-3;INFORMATION;Support;Academic Support Desk ;Chat with the Academic Service Desk;;Student;V1.1;T.3.1;Support Chat
Cross Journeys Onboarding;11;INFORMATIONV1.1;INFORMATIONV1.1-4;INFORMATION;Support;Academic Support Desk ;Answer academic requests on the chat;;Admin staff;V1.1;T.3.1;Support Chat
Cross Journeys Onboarding;12;INFORMATIONV1.1;INFORMATIONV1.1-5;INFORMATION;Support;Academic Support Desk ;Contact Ulysseus for more information;Select the topic of our query, provide detail on my request and my contact details to be called /emailed back ;Student;V1.1;T.3.1;Ticket management
Cross Journeys Onboarding;13;INFORMATIONV1.1;INFORMATIONV1.1-6;INFORMATION;Support;Academic Support Desk ;Address students' queries ;Get notified for new query, transfer a query, reply to a query, request clarifications ;Admin staff;V1.1;T.3.1;Ticket management
Cross Journeys Onboarding;14;INFORMATIONV1.1;INFORMATIONV1.1-7;INFORMATION;Support;Accessibility;Log in with my credentials from my university;The users will be able to log in with their credentials from their university;All users;V1.1;Not assigned;Authentication
Cross Journeys Onboarding;15;INFORMATIONV1.1;INFORMATIONV1.1-8;INFORMATION;Support;Accessibility;Select a language;Select a language (at least the language of the 6 universities of the Alliance);All users;V1.1;T.2.2;Language choice
Cross Journeys Onboarding;16;INFORMATIONV1.1;INFORMATIONV1.1-9;INFORMATION;Support;Accessibility;Access my Ulysseus through different devices ;Ensure responsive design so the user can access and review the different screens of the platform through a computer, a smartphone or a tablet ;All users;V1.1;Not assigned;Responsive
Cross Journeys Onboarding;17;INFORMATIONV1.1;INFORMATIONV1.1-10;INFORMATION;Support;Accessibility;Connect to all Ulysseus online services with my disabilities ;Follow the RGAA guidelines or other European Accessibility guidelines . Web accessibility encompasses all disabilities that affect access to the Web, including visual, auditory, physical, speech, cognitive, and neurological disabilities.;All users;V1.1;Not assigned;Inclusive interface
Cross Journeys Onboarding;18;REGISTRATIONV1.1;REGISTRATIONV1.1-1;REGISTRATION;Support;Administrative Support Desk ;Chat with the administrative support desk;;Student;V1.1;T.2.2;Support Chat
Cross Journeys Onboarding;19;REGISTRATIONV1.1;REGISTRATIONV1.1-2;REGISTRATION;Support;Administrative Support Desk ;Answer administrative requests on the chat;;Admin staff;V1.1;T.2.2;Support Chat
Cross Journeys Onboarding;20;REGISTRATIONV1.1;REGISTRATIONV1.1-3;REGISTRATION;Support;Administrative Support Desk ;Raise an administrative request online ;Select the nature of my request, detail my request, submit my request ;Student;V1.1;T.2.2;Ticket management
Cross Journeys Onboarding;21;REGISTRATIONV1.1;REGISTRATIONV1.1-4;REGISTRATION;Support;Administrative Support Desk ;Manage my administrative requests online ;Review the status of any administrative request raised online (e.g. change in learning agreement, grant status);Student;V1.1;T.2.2;Ticket management
Cross Journeys Onboarding;22;REGISTRATIONV1.1;REGISTRATIONV1.1-5;REGISTRATION;Support;Administrative Support Desk ;Process students' administrative requests ;Review the outstanding requests, trigger an alert if the request was not filled properly, re-assign a request to the right administrative person, close the request once it is addressed ;Admin staff;V1.1;T.2.2;Ticket management
Journey 1 Education;23;GRADUATIONV1.1;GRADUATIONV1.1-1;GRADUATION;Support;Administrative Support Desk ;Apply for graduation;Fill an application, upload documentation, save the application, review the application ;Student;V1.1;T.2.2;Ticket management
Journey 1 Education;24;GRADUATIONV1.1;GRADUATIONV1.1-2;GRADUATION;Support;Administrative Support Desk ;Request my official transcript;Fill an application, upload documentation, save the application, review the application ;Student;V1.1;T.2.2;Ticket management
Cross Journeys Onboarding;25;APPLICATIONV1.1;APPLICATIONV1.1-5;APPLICATION;Application;Admissions and Enrollment Management;Open a new program for admission ;"""Customize the application questionnaire to collect the required information from the students based on the program, set the application deadline, set the names of the approvers/reviewers 
Set an """"opening date"""" on the form, So they can """"create"""" it at anytime. """;Admin staff;V1.1;T.3.1;Application Forms Creation
Cross Journeys Onboarding;26;APPLICATIONV1.1;APPLICATIONV1.1-5;APPLICATION;Application;Admissions and Enrollment Management;Apply online for the program of my choice ;Submit the required documents, fill pre-filled questionnaires, save and review my application, submit my application;Student;V1.1;T.3.1;Application Submission
Cross Journeys Onboarding;27;APPLICATIONV1.1;APPLICATIONV1.1-5;APPLICATION;Application;Admissions and Enrollment Management;Track my application ;View the status of my application to know whether I have been accepted in my program, receive a notification if a document is missing ;Student;V1.1;T.3.1;Application Tracking & Notification Management
Cross Journeys Onboarding;28;APPLICATIONV1.1;APPLICATIONV1.1-5;APPLICATION;Application;Admissions and Enrollment Management;Divide the applications between multiple review staff ;Assign applications to one or more different reviewers ;Admin staff;V1.1;T.3.1;Approval Workflow management
Cross Journeys Onboarding;29;APPLICATIONV1.1;APPLICATIONV1.1-6;APPLICATION;Application;Admissions and Enrollment Management;Smooth post application communication with the student;Trigger an alert if a document is missing, Inform the student when there is an update related to his/ her application;Admin staff;V1.1;T.3.1;Application Tracking & Notification Management
Cross Journeys Onboarding;30;APPLICATIONV1.1;APPLICATIONV1.1-7;APPLICATION;Application;Admissions and Enrollment Management;Accept / reject an application;Manage sequential approvals to include all the stakeholders, complete the application review process with an approval or rejection;Admin staff;V1.1;T.3.1;Approval Workflow management
Cross Journeys Onboarding;31;APPLICATIONV1.1;APPLICATIONV1.1-8;APPLICATION;Application;Admissions and Enrollment Management;Track the approval process between the different approvers / universities ;Workflow management process for all stakeholders to view where is an application;Admin staff;V1.1;T.3.1;Approval Workflow management
Journey 1 Education;32;EXAMSV1.1;EXAMSV1.1-1;EXAMS;Application;Admissions and Enrollment Management;Generate final learning agreement;Generate final learning agreement once the student's grades are confirmed and process the required credit transfers;Admin staff;V1.1;T.6.8;Learning Agreement Management 
Journey 1 Education;33;GRADUATIONV1.1;GRADUATIONV1.1-3;GRADUATION;Application;Admissions and Enrollment Management;Manage students' application for graduation ;Track the applications received for graduation, automatically flag if a student does not meet the curriculum requirements, share the graduation convocation once the application is confirmed ;Admin staff;V1.1;Not assigned;Application Tracking & Notification Management
Cross Journeys Innovation;34;ENTREPRENEURSHIPV1.1;ENTREPRENEURSHIPV1.1-2;ENTREPRENEURSHIP;Application;Admissions and Enrollment Management;Apply to join the incubator / acceleration programs ;Fill an application, upload documentation, save the application, review the application ;Entrepreneur;V1.1;T.2.6;Application Submission
Cross Journeys Innovation;35;ENTREPRENEURSHIPV1.1;ENTREPRENEURSHIPV1.1-3;ENTREPRENEURSHIP;Application;Admissions and Enrollment Management;Track my application to the incubator;View the status of my application to know whether I have been accepted in my program, receive a notification if a document is missing ;Entrepreneur;V1.1;T.2.6;Application Tracking & Notification Management
Cross Journeys Innovation;36;ENTREPRENEURSHIPV1.1;ENTREPRENEURSHIPV1.1-4;ENTREPRENEURSHIP;Application;Admissions and Enrollment Management;Accept / reject an application for one of the incubation program;Manage sequential approvals to include all the stakeholders, complete the application review process with an approval or rejection;Admin staff;V1.1;T.2.6;Approval Workflow management
Cross Journeys Onboarding;37;REGISTRATIONV1.1;REGISTRATIONV1.1-6;REGISTRATION;Analytics;Admissions and Enrollment Management;Search students and generate a list of students based on a list of criteria;Track the incoming/outgoing registered Ulysseus students in a given semester, identify the first year students;Admin staff;V1.1;Not assigned;Reporting
Cross Journeys Onboarding;38;INFORMATIONV1.1;INFORMATIONV1.1-11;INFORMATION;Community & campus;Community & Campus Information;Find information about housing;View information about the areas, the prices, etc.;Student;V1.1;T.6.5;Information & Documentation
Cross Journeys Onboarding;39;INFORMATIONV1.1;INFORMATIONV1.1-12;INFORMATION;Community & campus;Community & Campus Information;Post and find housing ads;"""Publish an ad for an apartment / co-tenants 
Search through the ads""";Student;V1.1;T.6.5;Announcement Board
Cross Journeys Campus Life;40;CAMPUS LIFEV1.1;CAMPUS LIFEV1.1-1;CAMPUS LIFE;Community & campus;Community & Campus Information;Search information about Ulysseus student associations;Maintain the directory of all the students' associations, filter and search the associations based on a set of criteria ;Student;V1.1;T.2.7;Information Search
Cross Journeys Campus Life;41;CAMPUS LIFEV1.1;CAMPUS LIFEV1.1-2;CAMPUS LIFE;Community & campus;Community building and management;Create a mailing list ;Search people  based on a list of criteria, select all, unselect, select only a few, export to email addresses to outlook to create a mailing list ;Admin staff;V1.1;Not assigned;Mailing List
Cross Journeys Campus Life;42;CAMPUS LIFEV1.1;CAMPUS LIFEV1.1-3;CAMPUS LIFE;Community & campus;Community building and management;Share Campus-wide announcements;Inform students on the launch of new activities, events, campus rules through the announcement board targeting all the students  ;Admin staff;V1.1;T.2.7;Announcement Board
Cross Journeys Ecosystem Interactions;43;INTERACT WITH THE ECOSYSTEMV1.1;INTERACT WITH THE ECOSYSTEMV1.1-1;INTERACT WITH THE ECOSYSTEM;Community & campus;Community building and management;Search the Ulysseus directory ;Filter and search the Ulysseus directory by name, university, faculty;All users;V1.1;Not assigned;Ulysseus Directory 
Cross Journeys Onboarding;44;REGISTRATIONV1.1;REGISTRATIONV1.1-7;REGISTRATION;Learning and teaching;Courses administration;Upload the class schedule for the semester ;"""Provide the schedule of classes, the number of available slots, professor's name, online versus offline, the pre-requisites
""";Admin staff;V1.1;T.3.1;Planning Courses 
Cross Journeys Onboarding;45;REGISTRATIONV1.1;REGISTRATIONV1.1-8;REGISTRATION;Learning and teaching;Courses administration;Record the classes' equivalences;Map the equivalences between the different courses offered by the universities as they get approved by the program's directors and store the acknowledgement documents ;Admin staff;V1.1;T.6.1;Planning Courses 
Cross Journeys Onboarding;46;REGISTRATIONV1.1;REGISTRATIONV1.1-9;REGISTRATION;Learning and teaching;Courses administration;Get more information about the classes;Review the classes available in my program, identify the pre-requisites. Review the equivalences available across the Alliance for the same class. Search the available classes based on the key competencies, fields, availabilities ;Student;V1.1;T.3.1;Courses Catalog 
Cross Journeys Onboarding;47;REGISTRATIONV1.1;REGISTRATIONV1.1-10;REGISTRATION;Learning and teaching;Courses administration;Register in a class ;Confirm my registration in a class, request to be in waiting list, cancel my registration;Student;V1.1;T.3.1;Registration Management 
Cross Journeys Onboarding;48;REGISTRATIONV1.1;REGISTRATIONV1.1-11;REGISTRATION;Learning and teaching;Courses administration;Manage class registration ;Track the number of students registered through Ulysseus or the university's platform to a class, block the registration if the maximum number of students is reached for this class ;Admin staff;V1.1;T.3.1;Registration Management 
Cross Journeys Onboarding;49;REGISTRATIONV1.1;REGISTRATIONV1.1-12;REGISTRATION;Learning and teaching;Courses administration;Generate the list of students attending my classes ;Generate the list of student for each class, select the format (csv, pdf) and download ;Professor;V1.1;Not assigned;Reporting
Journey 1 Education;50;LECTURE & TUTOV1.1;LECTURE & TUTOV1.1-1;LECTURE & TUTO;Learning and teaching;Courses administration;Create my class's schedule ;Set the dates for the assignments, the lectures' due dates;Professor;V1.1;T.2.2;Courses Planning
Journey 1 Education;51;LECTURE & TUTOV1.1;LECTURE & TUTOV1.1-2;LECTURE & TUTO;Learning and teaching;Courses administration;Register to an open-access online class ;Review and search the catalog of available open classes (EU classes targeting citizens, language course, digital skills courses) by topic, create a profile for non-Ulysseus members with an email address,  ready the class description, register to a class, receive a confirmation;All users;V1.1;Not assigned;Registration Management 
Journey 2 Research Project Lifecycle;52;PROJECT FINANCINGV1.1;PROJECT FINANCINGV1.1-1;PROJECT FINANCING;Collaboration & communication;Customer/partners Relationship Management;Access the agencies directory;Search through a consolidated directory  of all agencies - their name, role & mission, key contact person ;Researchers;V1.1;T.2.2;Account Search 
Journey 2 Research Project Lifecycle;53;PROJECT FINANCINGV1.1;PROJECT FINANCINGV1.1-2;PROJECT FINANCING;Collaboration & communication;Customer/partners Relationship Management;Manage the agencies directory;Upload the existing information maintained by each university on the research agencies, any new entry in the respective university's directory is reflected at Ulysseus level ;Admin staff;V1.1;T.2.2;Account Management 
Journey 2 Research Project Lifecycle;54;COLLABORATEV1.1;COLLABORATEV1.1-1;COLLABORATE;Collaboration & communication;Customer/partners Relationship Management;Create accounts for external users;Create an account for an external user: private company, agency, territorial organization, indicate their industry, their field of interest ;Researchers & PhD students ;V1.1;T.2.2;Account Management 
Journey 2 Research Project Lifecycle;55;COLLABORATEV1.1;COLLABORATEV1.1-2;COLLABORATE;Collaboration & communication;Customer/partners Relationship Management;Administer accounts of external users ;Validate requests to create new accounts for external users, create new accounts, delete accounts, edit information;Admin staff;V1.1;T.2.2;Account Management 
Journey 2 Research Project Lifecycle;56;COLLABORATEV1.1;COLLABORATEV1.1-3;COLLABORATE;Collaboration & communication;Customer/partners Relationship Management;Update the contact details for each account ;Add a new contact in the account, select the confidentiality level of the information, map existing projects to an account card, upload documentation;Researchers & PhD students ;V1.1;T.2.2;Contact Management
Journey 2 Research Project Lifecycle;57;COLLABORATEV1.1;COLLABORATEV1.1-4;COLLABORATE;Collaboration & communication;Customer/partners Relationship Management;Record an interaction with a partner ;Update the contact card with details on the latest interaction;Researchers & PhD students ;V1.1;T.2.2;Interaction Tracking
Journey 2 Research Project Lifecycle;58;COLLABORATEV1.1;COLLABORATEV1.1-5;COLLABORATE;Collaboration & communication;Customer/partners Relationship Management;Track the interactions for each account ;Review the historical interactions with the partner;Researchers & PhD students ;V1.1;T.2.2;Interaction Tracking
Cross Journeys Onboarding;59;REGISTRATIONV1.1;REGISTRATIONV1.1-16;REGISTRATION;Analytics;Dashboard and Analytics ;Upload all the academic data that contribute for ranking (patents reference, KPIs);Upload a CSV file with the data;Admin staff;V1.1;Not assigned;Data Visualization
Cross Journeys Onboarding;60;REGISTRATIONV1.1;REGISTRATIONV1.1-16;REGISTRATION;Analytics;Dashboard and Analytics ;Generate Ulysseus KPIs;Consolidate and clean (anonymize) the data from the universities;Admin staff;V1.1;Not assigned;Data Visualization
Cross Journeys Onboarding;61;REGISTRATIONV1.1;REGISTRATIONV1.1-16;REGISTRATION;Analytics;Dashboard and Analytics ;Generate dashboard and track KPIs for the Ulysseus program ;Track selected KPIs for the bachelor and master students registered in the Ulysseus programs (i.e. gender, ages, partner universities, disabilities, mobility types);Admin staff;V1.1;Not assigned;Dashboards Generation
Cross Journeys Onboarding;62;REGISTRATIONV1.1;REGISTRATIONV1.1-16;REGISTRATION;Analytics;Dashboard and Analytics ;Access student's dashboard ;View the student's program, track student's progress along the program (completed classes, registered classes), location, GPA;Admin staff;V1.1;Not assigned;Data Visualization
Cross Journeys Onboarding;63;REGISTRATIONV1.1;REGISTRATIONV1.1-17;REGISTRATION;Analytics;Dashboard and Analytics ;Extract a list of data ;After I have obtained the list matching the criteria, I can extract this list in an excel format for example;Admin staff;V1.1;Not assigned;Data Extraction
Journey 1 Education;64;GROUP PROJECTSV1.1;GROUP PROJECTSV1.1-1;GROUP PROJECTS;Collaboration & communication;Document Management and Collaboration;Create a workspace;Create and manage a work group;Student;V1.1;Not assigned;Workspace Management
Journey 1 Education;65;GROUP PROJECTSV1.1;GROUP PROJECTSV1.1-2;GROUP PROJECTS;Collaboration & communication;Document Management and Collaboration;Share / access documents;Work together on files;Student;V1.1;Not assigned;Document Co-edit (CRUD)
Journey 1 Education;66;GROUP PROJECTSV1.1;GROUP PROJECTSV1.1-3;GROUP PROJECTS;Collaboration & communication;Document Management and Collaboration;Raise a request to grant access to documents to external partners ;;Student;V1.1;Not assigned;File Access Management 
Journey 1 Education;67;GROUP PROJECTSV1.1;GROUP PROJECTSV1.1-4;GROUP PROJECTS;Collaboration & communication;Document Management and Collaboration;Validate requests to grant access to external partners ;;Admin staff;V1.1;Not assigned;File Access Management 
Journey 2 Research Project Lifecycle;68;PROJECT FINANCINGV1.1;PROJECT FINANCINGV1.1-3;PROJECT FINANCING;Collaboration & communication;Document Management and Collaboration;Upload templates for proposals;Create / upload templates;Admin staff;V1.1;T.3.3;Document Repository 
Journey 2 Research Project Lifecycle;69;PROJECT FINANCINGV1.1;PROJECT FINANCINGV1.1-4;PROJECT FINANCING;Collaboration & communication;Document Management and Collaboration;Leverage templates to write proposals ;Browse through a library of proposal templates ;Researchers;V1.1;T.3.3;Document Repository 
Journey 2 Research Project Lifecycle;70;PROJECT FINANCINGV1.1;PROJECT FINANCINGV1.1-5;PROJECT FINANCING;Collaboration & communication;Document Management and Collaboration;Identify a call for projects for my research across a consolidated list of existing CFP;Search and access a consolidated list of  CFP (European, national, bi-national), filter the results based on my field of study, the value of financing, the time period ;Researchers;V1.1;T.3.3;Document Repository 
Journey 2 Research Project Lifecycle;71;PROJECT FINANCINGV1.1;PROJECT FINANCINGV1.1-6;PROJECT FINANCING;Collaboration & communication;Document Management and Collaboration;Join a team to co-write a Ulysseus proposal ;View the list of open proposals, search through by topics, identify names of the researchers, reply to the proposal ;Researchers;V1.1;T.3.3;Document Repository 
Journey 2 Research Project Lifecycle;72;PROJECT FINANCINGV1.1;PROJECT FINANCINGV1.1-7;PROJECT FINANCING;Collaboration & communication;Document Management and Collaboration;Co-write a proposal (edit online);Collaborate, write and edit scientific documents;Researchers;V1.1;T.3.3;Document Co-Edit
Journey 2 Research Project Lifecycle;73;RESEARCHV1.1;RESEARCHV1.1-1;RESEARCH;Collaboration & communication;Document Management and Collaboration;Search the list of existing IP assets available across Ulysseus ;Browse through the list of existing IP assets and search by asset type, university, research field, key words;Researchers & PhD students ;V1.1;Not assigned;Search function
Journey 2 Research Project Lifecycle;74;RESEARCHV1.1;RESEARCHV1.1-2;RESEARCH;Collaboration & communication;Document Management and Collaboration;Access the existing IP assets available across Ulysseus ;Read information about the asset and the name of the key contact person ;Researchers & PhD students ;V1.1;Not assigned;Document Repository 
Journey 2 Research Project Lifecycle;75;COLLABORATEV1.1;COLLABORATEV1.1-6;COLLABORATE;Collaboration & communication;Document Management and Collaboration;Create a virtual workspace with Ulysseus members to manage a research project ;Create a group, invite members, share documents;Researchers & PhD students ;V1.1;Not assigned;Workspace Management
Journey 2 Research Project Lifecycle;76;COLLABORATEV1.1;COLLABORATEV1.1-7;COLLABORATE;Collaboration & communication;Document Management and Collaboration;Share documents with my research project members;CRUD principle;Researchers & PhD students ;V1.1;Not assigned;Document Repository 
Journey 2 Research Project Lifecycle;77;PUBLISHV1.1;PUBLISHV1.1-1;PUBLISH;Collaboration & communication;Document Management and Collaboration;Share an article for feedbacks before publication;Post a publication on the review platform and ask for feedbacks.;Researchers & PhD students ;V1.1;Not assigned;
Journey 2 Research Project Lifecycle;78;PUBLISHV1.1;PUBLISHV1.1-2;PUBLISH;Collaboration & communication;Document Management and Collaboration;Review the latest articles shared by my colleagues;See the latest publications shared on the platform, filter by topic;Researchers & PhD students ;V1.1;Not assigned;
Journey 2 Research Project Lifecycle;79;PUBLISHV1.1;PUBLISHV1.1-3;PUBLISH;Collaboration & communication;Document Management and Collaboration;Provide an informal review on an article posted by a colleague ;Comment with a long text that can be structured in paragraph with different formatting styles;Researchers & PhD students ;V1.1;Not assigned;
