Journey ;ID;Code V0;Code VF;Experience;Theme;Service;Epic;Description;User;Priority;WP;Cartography 
Journey 2 Research Project Lifecycle;247;RESEARCHV1.1;RESEARCHV1.1-22;RESEARCH;Support;Research Support Desk  ;Chat with the research support desk;;Researchers;V1.1;T.3.3;Support Chat
Journey 2 Research Project Lifecycle;248;RESEARCHV1.1;RESEARCHV1.1-23;RESEARCH;Support;Research Support Desk  ;Answer research requests on the chat;;Admin staff;V1.1;T.3.3;Support Chat
Journey 2 Research Project Lifecycle;249;PROJECT FINANCINGV1.1;PROJECT FINANCINGV1.1-10;PROJECT FINANCING;Support;Research Support Desk  ;Request university's administration support to develop the research proposal ;Raise a request to request support from the University administration, fill information on the proposal ;Researchers;V1.1;T.3.3;Ticket management
Journey 2 Research Project Lifecycle;250;PROJECT FINANCINGV1.1;PROJECT FINANCINGV1.1-11;PROJECT FINANCING;Support;Research Support Desk  ;Support the development and the submission of Ulysseus research proposals ;Receive a notification, reply to the query, assign the ticket to the key person;Admin staff;V1.1;T.3.3;Ticket management
Journey 2 Research Project Lifecycle;251;RESEARCHV1.1;RESEARCHV1.1-24;RESEARCH;Support;Research Support Desk  ;Request support on a research project ;Raise a request to request support from the University administration, fill information on the project, define a level of criticality;Researchers;V1.1;Not assigned;Ticket management
Journey 2 Research Project Lifecycle;252;RESEARCHV1.1;RESEARCHV1.1-25;RESEARCH;Support;Research Support Desk  ;Manage my request for support on a research project ;View the status of my query, get a notification when my query status is updated ;Researchers;V1.1;Not assigned;Ticket management
Journey 2 Research Project Lifecycle;253;RESEARCHV1.1;RESEARCHV1.1-26;RESEARCH;Support;Research Support Desk  ;Process the requests ;View the status of my query, get a notification when my query status is updated ;Admin staff;V1.1;Not assigned;Ticket management
Journey 2 Research Project Lifecycle;254;RESEARCHV1.1;RESEARCHV1.1-27;RESEARCH;Resources management;Scientific facilities sharing ;Update the list of equipment available across the university;;Admin staff;V1.1;T.2.2;Equipment's List Repository
Journey 2 Research Project Lifecycle;255;RESEARCHV1.1;RESEARCHV1.1-28;RESEARCH;Resources management;Scientific facilities sharing ;Define the booking rules for each equipment ;Set rules for lab equipment booking times, durations, cancellations and approvals. ;Admin staff;V1.1;T.2.2;Booking Rules Configuration
Journey 2 Research Project Lifecycle;256;RESEARCHV1.1;RESEARCHV1.1-29;RESEARCH;Resources management;Scientific facilities sharing ;Review the technical equipment available across the ecosystem ;Browse and search through the list of technical equipment, read the description of the equipment, the price, the university, the name of the contact person ;Researchers & PhD students ;V1.1;T.2.2;Search function
Journey 2 Research Project Lifecycle;257;RESEARCHV1.1;RESEARCHV1.1-30;RESEARCH;Resources management;Scientific facilities sharing ;Review the available slots for an equipment;;Researchers & PhD students ;V1.1;T.2.2;Visualization of Availability 
Journey 2 Research Project Lifecycle;258;RESEARCHV1.1;RESEARCHV1.1-31;RESEARCH;Resources management;Scientific facilities sharing ;Book an equipment ;Book an equipment, receive a confirmation email after I book ;Researchers & PhD students ;V1.1;T.2.2;Booking Management
Journey 2 Research Project Lifecycle;259;RESEARCHV1.1;RESEARCHV1.1-32;RESEARCH;Resources management;Scientific facilities sharing ;Update my calendar with the reservation ;;Researchers & PhD students ;V1.1;T.2.2;Calendar Integration
Journey 2 Research Project Lifecycle;260;RESEARCHV1.1;RESEARCHV1.1-33;RESEARCH;Resources management;Scientific facilities sharing ;Run your experiment remotely;Share your experiment script and receive the results of the experiment;Researchers & PhD students ;V1.1;T.2.2;Lab Access Management
Journey 2 Research Project Lifecycle;261;RESEARCHV1.1;RESEARCHV1.1-34;RESEARCH;Resources management;Scientific facilities sharing ;Generate booking reports ;Overview of all scientific equipment bookings, the name of the individual / institution who has booked it and the associated tariff if applicable ;Admin staff;V1.1;T.2.2;Booking Reports
Cross Journeys Ecosystem Interactions;262;INTERACT WITH THE ECOSYSTEMV1.1;INTERACT WITH THE ECOSYSTEMV1.1-34;INTERACT WITH THE ECOSYSTEM;Resources management;Scientific facilities sharing ;Book universities' resources ;Review the list of available resources (i.e. meeting rooms, labs, equipment), book the resources, receive a confirmation;All users;V1.1;T.2.2;Equipment's List Repository
Journey 2 Research Project Lifecycle;263;RESEARCHV1.1;RESEARCHV1.1-35;RESEARCH;Resources management;Survey Management ;Create a survey;Access a library of survey templates, customize the survey, circulate the survey through a community of practice or the announcement board targeting the right audience ;Researchers & PhD students ;V1.1;Not assigned;Survey Maker
Journey 2 Research Project Lifecycle;264;RESEARCHV1.1;RESEARCHV1.1-36;RESEARCH;Resources management;Survey Management ;Share my survey;Generate a mailing list and share my survey with the targeted people ;Researchers & PhD students ;V1.1;Not assigned;Mailing List
Journey 2 Research Project Lifecycle;265;RESEARCHV1.1;RESEARCHV1.1-37;RESEARCH;Resources management;Survey Management ;Create dashboard from surveys' responses ;Create dashboard to visualize the surveys' responses ;Researchers & PhD students ;V1.1;Not assigned;Data Visualization
Journey 2 Research Project Lifecycle;266;RESEARCHV1.1;RESEARCHV1.1-38;RESEARCH;Resources management;Survey Management ;Compile and download survey's response ;Download the files in csv format, pdf format ;Researchers & PhD students ;V1.1;Not assigned;Survey Results Management
Journey 2 Research Project Lifecycle;267;COLLABORATEV1.1;COLLABORATEV1.1-20;COLLABORATE;Resources management;Survey Management ;Answer a survey ;Register with your Ulysseus ID/ fill it anonymously, save your answers ;Researchers & PhD students ;V1.1;Not assigned;Survey Completion
Cross Journeys Innovation;268;ENTREPRENEURSHIPV1.1;ENTREPRENEURSHIPV1.1-19;ENTREPRENEURSHIP;Resources management;Survey Management ;Run online experiences with external participants ;;Researchers & PhD students ;V1.1;T.2.6;Survey Completion
Cross Journeys Onboarding;269;INFORMATIONV1.1;INFORMATIONV1.1-19;INFORMATION;Support;Technical support desk ;Access the catalogue of services;Review the list of services, information about each services;Student;V1.1;T.2.2;Catalog of service
Cross Journeys Onboarding;270;INFORMATIONV1.1;INFORMATIONV1.1-20;INFORMATION;Support;Technical support desk ;Chat with the technical support desk;;Student;V1.1;T.2.2;Support Chat
Cross Journeys Onboarding;271;INFORMATIONV1.1;INFORMATIONV1.1-21;INFORMATION;Support;Technical support desk ;Answer technical requests on the chat;;Admin staff;V1.1;T.2.2;Support Chat
Cross Journeys Onboarding;272;INFORMATIONV1.1;INFORMATIONV1.1-22;INFORMATION;Support;Technical support desk ;Define the planning of collaborative support;"""Upload / Update the planning :
in function of the day,  the support will be operated by a specific university""";Admin staff;V1.1;T.2.2;
Cross Journeys Onboarding;273;INFORMATIONV1.1;INFORMATIONV1.1-23;INFORMATION;Support;Technical support desk ;Assign the tickets to the university according to the planning ;Assign tickets based on the available officers available that day  ;System;V1.1;T.2.2;
Cross Journeys Onboarding;274;INFORMATIONV1.1;INFORMATIONV1.1-24;INFORMATION;Support;Technical support desk ;Raise a technical request online;Select the nature of my request, detail my request, submit my request ;Student;V1.1;T.2.2;Ticket management
Cross Journeys Onboarding;275;INFORMATIONV1.1;INFORMATIONV1.1-25;INFORMATION;Support;Technical support desk ;Manage my technical requests online;Review the status of any technical request raised online (e.g. I cannot find my courses materials);Student;V1.1;T.2.2;Ticket management
Cross Journeys Onboarding;276;INFORMATIONV1.1;INFORMATIONV1.1-26;INFORMATION;Support;Technical support desk ;Process the requests;;Admin staff;V1.1;T.2.2;Ticket management
Cross Journeys Onboarding;277;INFORMATIONV1.1;INFORMATIONV1.1-27;INFORMATION;Support;Welcome Center Support desk ;Chat with the Welcome center Service Desk;;Student;V1.1;T.6.5;Support Chat
Cross Journeys Onboarding;278;INFORMATIONV1.1;INFORMATIONV1.1-28;INFORMATION;Support;Welcome Center Support desk ;Answer Welcome center requests on the chat;;Admin staff;V1.1;T.6.5;Support Chat
Cross Journeys Onboarding;279;REGISTRATIONV1.1;REGISTRATIONV1.1-26;REGISTRATION;Support;Welcome Center Support desk ;Raise a request regarding the Welcome Program ;Select the nature of my request (e.g. housing, logistics, visa) detail my request, submit my request ;Student;V1.1;T.6.5;Ticket management
Cross Journeys Onboarding;280;REGISTRATIONV1.1;REGISTRATIONV1.1-27;REGISTRATION;Support;Welcome Center Support desk ;Manage my administrative requests online ;Review the status of any administrative request raised online (e.g. change in learning agreement, grant status);Student;V1.1;T.6.5;Ticket management
Cross Journeys Onboarding;281;REGISTRATIONV1.1;REGISTRATIONV1.1-28;REGISTRATION;Support;Welcome Center Support desk ;Process the requests regarding the Welcome Program ;;Admin staff;V1.1;T.6.5;Ticket management
