Journey ;ID;Code V0;Code VF;Experience;Theme;Service;Epic;Description;User;Priority;WP;Cartography 
Cross Journeys Onboarding;161;APPLICATIONV1.1;APPLICATIONV1.1-15;APPLICATION;Application;Mobility;Generate the learning agreement once a student is accepted, based on the information provided by the student ;Select the learning agreement based on the program, auto populate the Learning Agreement form based on the information submitted by the student, review and validate the agreement ;Admin staff;V1.1;T.6.8;Application Submission
Cross Journeys Onboarding;162;APPLICATIONV1.1;APPLICATIONV1.1-16;APPLICATION;Application;Mobility;Sign my learning agreement ;Review the agreement and sign using electronic signature ;Student;V1.1;T.6.8;Electronic signature
Cross Journeys Onboarding;163;APPLICATIONV1.1;APPLICATIONV1.1-17;APPLICATION;Application;Mobility;Accept / reject a learning agreement;"""The admin has the possibility to propose modifications on the LA or accept/reject it.
When the application is accepted, it is forwarder to the MIC for completion""";Admin staff;V1.1;T.6.8;Approval Workflow Management 
Cross Journeys Onboarding;164;REGISTRATIONV1.1;REGISTRATIONV1.1-20;REGISTRATION;Application;Mobility;Generate updated learning agreements if required based on the class selection ;Modify the learning agreement if the selection of classes differ from the initial learning agreement, review and validate the agreement ;Admin staff;V1.1;T.6.8;Approval Workflow Management 
Journey 1 Education;165;GROUP PROJECTSV1.1;GROUP PROJECTSV1.1-5;GROUP PROJECTS;Collaboration & communication;Online communication;Schedule a virtual meeting with my team;Select a slot, send an invite ;Student;V1.1;T.1;Booking Meetings 
Journey 1 Education;166;GROUP PROJECTSV1.1;GROUP PROJECTSV1.1-6;GROUP PROJECTS;Collaboration & communication;Online communication;Attend a virtual meeting with my team;Attend a video call with my group to collaborate remotely, share my screen;Student;V1.1;T.1;Audio Call (1-1 / 1 to many)
Journey 1 Education;167;GROUP PROJECTSV1.1;GROUP PROJECTSV1.1-7;GROUP PROJECTS;Collaboration & communication;Online communication;Create a group chat ;write messages, comment on messages, delete, search messages ;Student;V1.1;T.1;Group Chat 
Journey 2 Research Project Lifecycle;168;COLLABORATEV1.1;COLLABORATEV1.1-16;COLLABORATE;Collaboration & communication;Online communication;Communicate with my research group members;chat;Researchers & PhD students ;V1.1;T.1;Group chat
Cross Journeys Ecosystem Interactions;169;INTERACT WITH THE ECOSYSTEMV1.1;INTERACT WITH THE ECOSYSTEMV1.1-21;INTERACT WITH THE ECOSYSTEM;Collaboration & communication;Online communication;Communicate remotely with the rest of Ulysseus ecosystem ;1 to 1, 1 to many, many to many communication;All users;V1.1;T.1;Audio Call (1-1 / 1 to many)
Cross Journeys Ecosystem Interactions;170;INTERACT WITH THE ECOSYSTEMV1.1;INTERACT WITH THE ECOSYSTEMV1.1-22;INTERACT WITH THE ECOSYSTEM;Collaboration & communication;Online communication;Review my calendar before booking a meeting;;All users;V1.1;T.1;Calendar Synchronization
Cross Journeys Ecosystem Interactions;171;INTERACT WITH THE ECOSYSTEMV1.1;INTERACT WITH THE ECOSYSTEMV1.1-23;INTERACT WITH THE ECOSYSTEM;Collaboration & communication;Online communication;Manage my meetings;Schedule a meeting, cancel a meeting, etc.;All users;V1.1;T.1;Booking Meetings 
Cross Journeys Ecosystem Interactions;172;INTERACT WITH THE ECOSYSTEMV1.1;INTERACT WITH THE ECOSYSTEMV1.1-24;INTERACT WITH THE ECOSYSTEM;Collaboration & communication;Online communication;Attend a meeting prof / student;Visio available at the selected time if the meeting is online;Student;V1.1;T.1;Audio Call (1-1 / 1 to many)
Cross Journeys Ecosystem Interactions;173;INTERACT WITH THE ECOSYSTEMV1.1;INTERACT WITH THE ECOSYSTEMV1.1-25;INTERACT WITH THE ECOSYSTEM;Collaboration & communication;Online communication;Create a group chat ;write messages, comment on messages, delete, search messages ;All users;V1.1;T.1;Group Chat
Cross Journeys Ecosystem Interactions;174;INTERACT WITH THE ECOSYSTEMV1.1;INTERACT WITH THE ECOSYSTEMV1.1-26;INTERACT WITH THE ECOSYSTEM;Collaboration & communication;Online communication;Engage with my professors;Review the list of available slots, select physical or online meeting, book a slot, receive a confirmation;Student;V1.1;Not assigned;Booking Meetings 
Cross Journeys Ecosystem Interactions;175;INTERACT WITH THE ECOSYSTEMV1.1;INTERACT WITH THE ECOSYSTEMV1.1-27;INTERACT WITH THE ECOSYSTEM;Collaboration & communication;Online communication;Engage with my students ;Upload a list of available timeslots for meetings (online or physical), receive an update when a slot is booked ;Professor;V1.1;Not assigned;Booking Meetings 
Cross Journeys Exit Program;176;EXIT A PROGRAMV1.1;EXIT A PROGRAMV1.1-15;EXIT A PROGRAM;Collaboration & communication;Online communication;Engage with student on their career ;Upload a list of available timeslots for meetings (online or physical), receive an update when a slot is booked ;Admin staff;V1.1;T.4.2;Booking Meetings 
Cross Journeys Exit Program;177;EXIT A PROGRAMV1.1;EXIT A PROGRAMV1.1-16;EXIT A PROGRAM;Collaboration & communication;Online communication;Engage with a career counsellor;Review the list of available slots, select physical or online meeting, book a slot, receive a confirmation;Student;V1.1;T.4.2;Booking Meetings 
Cross Journeys Innovation;178;ENTREPRENEURSHIPV1.1;ENTREPRENEURSHIPV1.1-12;ENTREPRENEURSHIP;Collaboration & communication;Online communication;Meet a coach / an expert ;Review the list of available slots, select physical or online meeting, book a slot, receive a confirmation;Entrepreneur;V1.1;T.2.6;Booking Meetings 
Cross Journeys Innovation;179;ENTREPRENEURSHIPV1.1;ENTREPRENEURSHIPV1.1-13;ENTREPRENEURSHIP;Collaboration & communication;Online communication;Attend a visio call with a coach ;Visio available at the selected time if the meeting is online;Entrepreneur;V1.1;T.2.6;Audio Call (1-1 / 1 to many)
Cross Journeys Innovation;180;ENTREPRENEURSHIPV1.1;ENTREPRENEURSHIPV1.1-14;ENTREPRENEURSHIP;Collaboration & communication;Online communication;Meet the entrepreneurs ;"""Provide a list of available slots 
""";Researchers & PhD students ;V1.1;T.2.6;Booking Meetings 
Cross Journeys Innovation;181;ENTREPRENEURSHIPV1.1;ENTREPRENEURSHIPV1.1-15;ENTREPRENEURSHIP;Collaboration & communication;Online communication;Attend a visio call with the entrepreneurs ;"""Provide a list of available slots 
""";Researchers & PhD students ;V1.1;T.2.6;Booking Meetings 
Cross Journeys Onboarding;182;INFORMATIONV1.1;INFORMATIONV1.1-17;INFORMATION;Community & campus;Online event management;Organize informative sessions for students before Admission starts;Upload the events' information, schedule and host informative sessions to provide an overview of the Ulysseus programs, the application process, admission requirements, a curriculum review.;Admin staff;V1.1;T.6.5;Events Creation
Cross Journeys Onboarding;183;INFORMATIONV1.1;INFORMATIONV1.1-18;INFORMATION;Community & campus;Online event management;Attend an informative session before the admission starts ;Review the available slots, book an informative session slot, receive a confirmation email after I book ;Student;V1.1;T.6.5;Event Registration
Cross Journeys Onboarding;184;REGISTRATIONV1.1;REGISTRATIONV1.1-21;REGISTRATION;Community & campus;Online event management;Schedule welcome session for students (& faculty / admin members in mobility);Upload the events' information, schedule and host informative sessions to welcome students, share information on the city / university ;Admin staff;V1.1;T.6.5;Events Creation
Cross Journeys Onboarding;185;REGISTRATIONV1.1;REGISTRATIONV1.1-22;REGISTRATION;Community & campus;Online event management;Register to a welcome session ;"""Review the available slots, book a session, receive a confirmation email after I book , receive an event reminder 
""";All users;V1.1;T.6.5;Event Registration
Cross Journeys Onboarding;186;REGISTRATIONV1.1;REGISTRATIONV1.1-23;REGISTRATION;Community & campus;Online event management;Attend a virtual welcome session ;Host the welcome session -> participants can move around a virtual room, engage in smaller groups conversations, or listen to a conference;All users;V1.1;T.6.5;Online Event Hosting 
Journey 1 Education;187;GRADUATIONV1.1;GRADUATIONV1.1-4;GRADUATION;Community & campus;Online event management;Communicate the graduation calendar;Upload the graduation schedule ;Admin staff;V1.1;Not assigned;Events Creation
Journey 2 Research Project Lifecycle;188;COLLABORATEV1.1;COLLABORATEV1.1-17;COLLABORATE;Community & campus;Online event management;Create a networking event (Research Lunch) / PhD conferences ;Schedule events :  upload events information (whether the event is virtual or physical), set a maximum of attendees, track the registration.;Researchers & PhD students ;V1.1;T.3.3;Event Registration
Journey 2 Research Project Lifecycle;189;COLLABORATEV1.1;COLLABORATEV1.1-18;COLLABORATE;Community & campus;Online event management;Register for a networking event (Research Lunch) / PhD conferences ;Review the list of events organized for researchers, register, receive a confirmation  ;Researchers & PhD students ;V1.1;T.3.3;Event Registration
Journey 2 Research Project Lifecycle;190;COLLABORATEV1.1;COLLABORATEV1.1-19;COLLABORATE;Community & campus;Online event management;Attend  for a networking event (Research Lunch) / PhD conferences ;host the event -> participants can move around a virtual room, engage in smaller groups conversations, or listen to a conference;Researchers & PhD students ;V1.1;T.3.3;Online Event Hosting 
Cross Journeys Campus Life;191;CAMPUS LIFEV1.1;CAMPUS LIFEV1.1-4;CAMPUS LIFE;Community & campus;Online event management;Organize campus-wide events ;"""Schedule events :  upload events information (whether the event is virtual or physical), set a maximum of attendees, track the registration.
""";Admin staff;V1.1;T.2.7;Events Creation
Cross Journeys Campus Life;192;CAMPUS LIFEV1.1;CAMPUS LIFEV1.1-5;CAMPUS LIFE;Community & campus;Online event management;Recruit volunteers for an event ;Create opening slots to volunteer for an event, assign timeslots, add a description of the role ;Admin staff;V1.1;T.2.7;Events Creation
Cross Journeys Campus Life;193;CAMPUS LIFEV1.1;CAMPUS LIFEV1.1-6;CAMPUS LIFE;Community & campus;Online event management;Register as a volunteer for an event ;Review the open slots and the associated description and register, fill the required information ;Student;V1.1;T.2.7;Event Registration
Cross Journeys Campus Life;194;CAMPUS LIFEV1.1;CAMPUS LIFEV1.1-7;CAMPUS LIFE;Community & campus;Online event management;Register for an event;Review the list of events organized across all the campus, register, receive a confirmation  ;All users;V1.1;T.2.7;Event Registration
Cross Journeys Campus Life;195;CAMPUS LIFEV1.1;CAMPUS LIFEV1.1-8;CAMPUS LIFE;Community & campus;Online event management;Attend a virtual event ;Join the event -> participants can move around a virtual room, engage in smaller groups conversations, or listen to a conference;Student;V1.1;T.2.7;Online Events hosting 
Cross Journeys Campus Life;196;CAMPUS LIFEV1.1;CAMPUS LIFEV1.1-9;CAMPUS LIFE;Community & campus;Online event management;Watch the event replay;Watch the replay of a past event (webinar format);Student;V1.1;T.2.7;Online Events hosting 
Cross Journeys Campus Life;197;CAMPUS LIFEV1.1;CAMPUS LIFEV1.1-10;CAMPUS LIFE;Community & campus;Online event management;Manage a live stream event ;Live stream from multiple sources in a multi-camera events, enable multiple speakers located in different locations ;Admin staff;V1.1;T.2.7;Live Events
Cross Journeys Exit Program;198;EXIT A PROGRAMV1.1;EXIT A PROGRAMV1.1-17;EXIT A PROGRAM;Community & campus;Online event management;Organize job fairs or informative sessions ;Schedule events :  upload events information (whether the event is virtual or physical), set a maximum of attendees, track the registration;Admin staff;V1.1;T.6.6;Events Creation
Cross Journeys Exit Program;199;EXIT A PROGRAMV1.1;EXIT A PROGRAMV1.1-18;EXIT A PROGRAM;Community & campus;Online event management;Register to job fairs ;Review the list of events organized across all the campus, register, receive a confirmation  ;Student;V1.1;T.6.6;Event Registration
Cross Journeys Exit Program;200;EXIT A PROGRAMV1.1;EXIT A PROGRAMV1.1-19;EXIT A PROGRAM;Community & campus;Online event management;Attend virtual job fair;host the event -> participants can move around a virtual room, engage in smaller groups conversations, or listen to a conference;Student;V1.1;T.6.6;Online Event Hosting 
Journey 1 Education;201;LECTURE & TUTOV1.1;LECTURE & TUTOV1.1-19;LECTURE & TUTO;Learning and teaching;Online exams;Complete assignments ;Complete online quizzes, submit my assignments online to my teacher;Student;V1.1;T.2.2;Assignments Completion
Journey 1 Education;202;EXAMSV1.1;EXAMSV1.1-2;EXAMS;Learning and teaching;Online exams;Schedule and create online exams to test my students remotely ;Schedule the assignment, select a test format (multiple choices, open-ended questions, multi select questions), select an exam existing template, upload the assignment content, create quizzes, apply time limits, select random selection of questions from a question pool ;Professor;V1.1;Not assigned;Assignments Creation
Journey 1 Education;203;EXAMSV1.1;EXAMSV1.1-3;EXAMS;Learning and teaching;Online exams;Share the schedule of exams;Upload the timing of each exam, the instructions for online exams or indicate the exam classroom ;Admin staff;V1.1;Not assigned;Schedule Management 
Journey 1 Education;204;EXAMSV1.1;EXAMSV1.1-4;EXAMS;Learning and teaching;Online exams;Administer proctor online exams ;;Admin staff;V1.1;Not assigned;Proctor Exams
Journey 1 Education;205;EXAMSV1.1;EXAMSV1.1-5;EXAMS;Learning and teaching;Online exams;Complete my exam online;Login for my exam, try out the solution ahead of the workshop, start my exam, review my work and submit ;Student;V1.1;Not assigned;Assignments Completion
Journey 1 Education;206;EXAMSV1.1;EXAMSV1.1-6;EXAMS;Learning and teaching;Online exams;Divide grading of online exams between professors and TA ;Assign open text sections to different reviewers ;Professor;V1.1;Not assigned;Assignments Grading 
Journey 1 Education;207;EXAMSV1.1;EXAMSV1.1-7;EXAMS;Learning and teaching;Online exams;Correct online exams ;Request automatic scoring and grading for multiple choices sections, review open-ended questions sections, assign grades to open-ended questions;Professor;V1.1;Not assigned;Assignments Grading 
Journey 1 Education;208;EXAMSV1.1;EXAMSV1.1-8;EXAMS;Learning and teaching;Online exams;Generate individual and group performance reports ;Generate reports at the course level and at individual level, review the average and the median ;Professor;V1.1;Not assigned;Performance Reporting & Dashboards
Journey 1 Education;209;LECTURE & TUTOV1.1;LECTURE & TUTOV1.1-20;LECTURE & TUTO;Learning and teaching;Online exams ;Receive a certificate upon course completion ;;All users;V1.1;T.5.2;Certification Management 
Journey 1 Education;210;GROUP PROJECTSV1.1;GROUP PROJECTSV1.1-8;GROUP PROJECTS;Learning and teaching;Online exams ;Complete peers' evaluation;Rate the involvement of each team member, provide comments, submit and share with my professor;Student;V1.1;T.2.2;Peers Evaluation
Journey 1 Education;211;GROUP PROJECTSV1.1;GROUP PROJECTSV1.1-9;GROUP PROJECTS;Resources management;Open access database;Research scientific publications across the Alliance to enrich my work;Run a search of publications and articles based on a set of criteria ;Student;V1.1;T.7.9;Publications Search
Journey 2 Research Project Lifecycle;212;RESEARCHV1.1;RESEARCHV1.1-3;RESEARCH;Resources management;Open access database;Search publications through the open database of Ulysseus;The users should be able to search by DOI, structure reference, faculty…;Researchers & PhD students ;V1.1;T.7.9;Publications Search
Journey 2 Research Project Lifecycle;213;RESEARCHV1.1;RESEARCHV1.1-4;RESEARCH;Resources management;Open access database;Access a publication;Select a publication, preview, download.;Researchers & PhD students ;V1.1;T.7.9;Publications Access
Journey 2 Research Project Lifecycle;214;RESEARCHV1.1;RESEARCHV1.1-5;RESEARCH;Resources management;Open access database;Identify where the publication is available;See the reference of the publication and access the link to the platform where the publication is available (web of science, Scopus);Researchers & PhD students ;V1.1;T.7.9;
Journey 2 Research Project Lifecycle;215;PUBLISHV1.1;PUBLISHV1.1-4;PUBLISH;Resources management;Open access database;Create a referencing of publications available on other platforms;"""Crawl other open access databases to collect publication's metadata and create a referencing 
The data should be transferred to a pipeline that will clean it and value it (deduplication...)""";System;V1.1;T.7.9;Referencing of External Publications
Journey 2 Research Project Lifecycle;216;PUBLISHV1.1;PUBLISHV1.1-5;PUBLISH;Resources management;Open access database;Publish my article on Ulysseus shared repository platform;Upload my article;Researchers & PhD students ;V1.1;T.7.9;Internal Publications Repository  
Cross Journeys Onboarding;217;INTERACT WITH THE ECOSYSTEMV1.1;INTERACT WITH THE ECOSYSTEMV1.1-28;INTERACT WITH THE ECOSYSTEM;Community & campus;Personal page;Receive all my e-mails in one place (email, messages on my intranet page);Receive all my notifications in one place (email, messages on my intranet page);All users;V1.1;T.2.2;Email
Cross Journeys Onboarding;218;INTERACT WITH THE ECOSYSTEMV1.1;INTERACT WITH THE ECOSYSTEMV1.1-29;INTERACT WITH THE ECOSYSTEM;Community & campus;Personal page;Get notified when I receive an e-mail;;All users;V1.1;T.2.2;Notification Management 
Cross Journeys Onboarding;219;INTERACT WITH THE ECOSYSTEMV1.1;INTERACT WITH THE ECOSYSTEMV1.1-30;INTERACT WITH THE ECOSYSTEM;Community & campus;Personal page;Send e-mails;;All users;V1.1;T.2.2;Email
Cross Journeys Onboarding;220;REGISTRATIONV1.1;REGISTRATIONV1.1-24;REGISTRATION;Community & campus;Personal page;Access my calendar for the semester;"""See my list of classes, their respective timings, the assigned classroom 
See my appointments (meetings with a with a student, booking of a resource…)
""";Professor;V1.1;T.2.2;Calendar Management 
Cross Journeys Onboarding;221;REGISTRATIONV1.1;REGISTRATIONV1.1-25;REGISTRATION;Community & campus;Personal page;Access my calendar for the semester;"""See my list of classes, their respective timings, the assigned classroom 
See my appointments (meetings with a with a prof, booking of a resource…)
""";Student;V1.1;T.2.2;Calendar Management 
Journey 1 Education;222;EXAMSV1.1;EXAMSV1.1-9;EXAMS;Community & campus;Personal page;View my exams schedule ;;Student;V1.1;T.2.2;Calendar Management 
Journey 1 Education;223;EXAMSV1.1;EXAMSV1.1-10;EXAMS;Community & campus;Personal page;Review my transcripts and my cumulative GPA ;Check my grades for each class and my overall ranking ;Student;V1.1;T.2.2;Performance Reporting 
Journey 1 Education;224;EXAMSV1.1;EXAMSV1.1-11;EXAMS;Community & campus;Personal page;Review the list of classes completed and the associated grades;;Student;V1.1;T.2.2;Performance Reporting 
Cross Journeys Ecosystem Interactions;225;INTERACT WITH THE ECOSYSTEMV1.1;INTERACT WITH THE ECOSYSTEMV1.1-31;INTERACT WITH THE ECOSYSTEM;Community & campus;Personal page;Map / assign a mentor to a mentee;;Admin staff;V1.1;T.4.2;Profile Management 
Cross Journeys Ecosystem Interactions;226;INTERACT WITH THE ECOSYSTEMV1.1;INTERACT WITH THE ECOSYSTEMV1.1-32;INTERACT WITH THE ECOSYSTEM;Community & campus;Personal page;Map / assign a mentee to a mentor;;Admin staff;V1.1;T.4.2;Profile Management 
Cross Journeys Ecosystem Interactions;227;INTERACT WITH THE ECOSYSTEMV1.1;INTERACT WITH THE ECOSYSTEMV1.1-33;INTERACT WITH THE ECOSYSTEM;Community & campus;Personal page;Manage my internal profile online ;Update my information stored in my profile (e.g. mobile number, profile picture);All users;V1.1;T.2.2;Profile Management 
Cross Journeys Innovation;228;ENTREPRENEURSHIPV1.1;ENTREPRENEURSHIPV1.1-16;ENTREPRENEURSHIP;Community & campus;Personal page;Create a profile for the external entrepreneurs who have been enrolled in the incubator ;;Admin staff;V1.1;T.2.6;Profile Management 
Journey 2 Research Project Lifecycle;229;RESEARCHV1.1;RESEARCHV1.1-6;RESEARCH;Resources management;Project Management ;Create a project ID card ;Present the project scope, import the list of work packages and subtasks, the underlying project plan and financing model, the sources of funding's, the names of the researchers;Researchers;V1.1;T.1;Project Planning
Journey 2 Research Project Lifecycle;230;RESEARCHV1.1;RESEARCHV1.1-7;RESEARCH;Resources management;Project Management ;Administer the project ID cards ;Review existing project ID cards, delete old and expired project ID cards, validate new project ID cards ;Admin staff;V1.1;T.1;Project Planning
Journey 2 Research Project Lifecycle;231;RESEARCHV1.1;RESEARCHV1.1-8;RESEARCH;Resources management;Project Management ;Assign and coordinate work among the teams;Assign tasks to a researchers, create, update and delete dependencies among tasks;Researchers;V1.1;T.1;Work Allocation
Journey 2 Research Project Lifecycle;232;RESEARCHV1.1;RESEARCHV1.1-9;RESEARCH;Resources management;Project Management ;Manage the project progress ;Update the completion level against the tasks and work packages, comment on the progress of each task and work package, update milestones, trigger alerts when an action is delayed;Researchers;V1.1;T.1;Project Reporting 
Journey 2 Research Project Lifecycle;233;RESEARCHV1.1;RESEARCHV1.1-10;RESEARCH;Resources management;Project Management ;Review the workload allocated to each team member;Develop a view of the assigned tasks by researcher ;Researchers;V1.1;T.1;Resources Capacity & Management 
Journey 2 Research Project Lifecycle;234;RESEARCHV1.1;RESEARCHV1.1-11;RESEARCH;Resources management;Project Management ;Record project risks ;Create new risks, add description, assign risk level ;Researchers;V1.1;T.1;Project Reporting 
Journey 2 Research Project Lifecycle;235;RESEARCHV1.1;RESEARCHV1.1-12;RESEARCH;Resources management;Project Management ;Generate reports ;Project status reports, risk reports, variance reports;Researchers;V1.1;T.1;Reports Generation
Journey 2 Research Project Lifecycle;236;RESEARCHV1.1;RESEARCHV1.1-13;RESEARCH;Resources management;Project Management ;Track the status of the ongoing projects;Review the project ID card that includes the names of the participants (researchers and contractual), the sources of funding's, the outstanding balance, starting date;Admin staff;V1.1;T.1;Project Reporting 
Journey 2 Research Project Lifecycle;237;RESEARCHV1.1;RESEARCHV1.1-14;RESEARCH;Resources management;Project Management ;Visualize project progress ;Dashboards and visualization tools to review the completion level of each task  / WP  and at project level, flag any delay, outstanding actions ;Researchers;V1.1;T.1;Visualization & Performance Dashboards
Journey 2 Research Project Lifecycle;238;RESEARCHV1.1;RESEARCHV1.1-15;RESEARCH;Resources management;Project Management ;Trigger alerts for project events ;Trigger alerts for past due actions, upcoming actions, modify notifications settings ;Researchers;V1.1;T.1;Notification Management 
Journey 2 Research Project Lifecycle;239;RESEARCHV1.1;RESEARCHV1.1-16;RESEARCH;Resources management;Project Management ;Initiate a purchase request ;Complete pre-fill questionnaire that would define the approval workflow, attached required document(s), review the request, validate the request ;Researchers;V1.1;T.1;Project Expenses Management
Journey 2 Research Project Lifecycle;240;RESEARCHV1.1;RESEARCHV1.1-17;RESEARCH;Resources management;Project Management ;Track the status of my purchase request ;Review the status of my request, get notified at each approval stage, get notified if a document / information is missing ;Researchers;V1.1;T.1;Project Expenses Management
Journey 2 Research Project Lifecycle;241;RESEARCHV1.1;RESEARCHV1.1-18;RESEARCH;Resources management;Project Management ;Validate purchase requests ;Receive notifications when a purchase request is created, review the request, approve the request , send back to the initiator if an information is missing, decline the request ;Admin staff;V1.1;T.1;Project Expenses Management
Journey 2 Research Project Lifecycle;242;RESEARCHV1.1;RESEARCHV1.1-19;RESEARCH;Resources management;Project Management ;Create a new project expense ;Record projects expenses, map the expenses to the different work packages and tasks;Researchers;V1.1;T.1;Project Expenses Management
Journey 2 Research Project Lifecycle;243;RESEARCHV1.1;RESEARCHV1.1-20;RESEARCH;Resources management;Project Management ;Tack my project expenses;Review the outstanding balances at work package and task level,;Researchers;V1.1;T.1;Project Budget Management 
Journey 2 Research Project Lifecycle;244;RESEARCHV1.1;RESEARCHV1.1-21;RESEARCH;Resources management;Project Management ;Upload financial supporting documents;Upload, save and organize receipts or any supporting documents  in different formats ;Researchers;V1.1;T.1;Shared documents repository 
Cross Journeys Innovation;245;ENTREPRENEURSHIPV1.1;ENTREPRENEURSHIPV1.1-17;ENTREPRENEURSHIP;Resources management;Project Management ;Create a project page and provide access to the entrepreneur(s);;Admin staff;V1.1;T.2.6;Project Access Management
Cross Journeys Innovation;246;ENTREPRENEURSHIPV1.1;ENTREPRENEURSHIPV1.1-18;ENTREPRENEURSHIP;Resources management;Project Management ;Create my project plan ;;Entrepreneur;V1.1;T.2.6;Project Planning
